{
  "counts": {
    "added": 1,
    "deleted": 1
  },
  "buckets": {
    "generated": {
      "added": 0,
      "deleted": 0
    },
    "vendor": {
      "added": 0,
      "deleted": 0
    },
    "tests": {
      "added": 0,
      "deleted": 0
    },
    "config": {
      "added": 0,
      "deleted": 0
    },
    "docs": {
      "added": 0,
      "deleted": 0
    },
    "application": {
      "added": 1,
      "deleted": 1
    },
    "unknown": {
      "added": 0,
      "deleted": 0
    }
  },
  "files": [
    {
      "old_path": "app/a.py",
      "new_path": "app/a.py",
      "bucket": "application",
      "counts": {
        "added": 1,
        "deleted": 1
      },
      "coverage": {
        "status": "complete",
        "notices": []
      },
      "flags": []
    }
  ],
  "locators": [
    {
      "path": "app/a.py",
      "side": "old",
      "line": 1,
      "hunk_index": 0,
      "kind": "deleted",
      "snapshot_id": "33333333-3333-3333-3333-333333333333",
      "snapshot_hash": "35e16f7004e359b9120dddadd03ea0aac5a2c1ebab27f5ed598328462536402d",
      "base_sha": "aaaaaaaaaaaaaaaaaaaaaaaaaaaaaaaaaaaaaaaa",
      "head_sha": "bbbbbbbbbbbbbbbbbbbbbbbbbbbbbbbbbbbbbbbb"
    },
    {
      "path": "app/a.py",
      "side": "new",
      "line": 1,
      "hunk_index": 0,
      "kind": "added",
      "snapshot_id": "33333333-3333-3333-3333-333333333333",
      "snapshot_hash": "35e16f7004e359b9120dddadd03ea0aac5a2c1ebab27f5ed598328462536402d",
      "base_sha": "aaaaaaaaaaaaaaaaaaaaaaaaaaaaaaaaaaaaaaaa",
      "head_sha": "bbbbbbbbbbbbbbbbbbbbbbbbbbbbbbbbbbbbbbbb"
    }
  ],
  "omitted_locator_count": 0,
  "coverage": {
    "status": "complete",
    "notices": []
  },
  "patch": {
    "status": "exact",
    "hash": "35e16f7004e359b9120dddadd03ea0aac5a2c1ebab27f5ed598328462536402d"
  },
  "version": "developer-analysis-output-v1",
  "run_id": "11111111-1111-1111-1111-111111111111",
  "request_id": "22222222-2222-2222-2222-222222222222",
  "input_hash": "68c49a42c2e9767085b17b41830073ac02e6b1a6af05feac46f1bbe2bb06fb91",
  "pins": {
    "criterion_version_ids": [],
    "task_version_ids": []
  },
  "analyzer_version": "unified-diff-v1",
  "rule_version": "developer-taxonomy-v1",
  "snapshot": {
    "id": "33333333-3333-3333-3333-333333333333",
    "hash": "35e16f7004e359b9120dddadd03ea0aac5a2c1ebab27f5ed598328462536402d",
    "base_sha": "aaaaaaaaaaaaaaaaaaaaaaaaaaaaaaaaaaaaaaaa",
    "head_sha": "bbbbbbbbbbbbbbbbbbbbbbbbbbbbbbbbbbbbbbbb"
  },
  "redaction_version": "secret-gate-v1",
  "redaction_hash": "35e16f7004e359b9120dddadd03ea0aac5a2c1ebab27f5ed598328462536402d"
}
